Timestamp,Age,Gender,Education Qualification(mention the specialization),Year of completion,Are you happy with the program what you studied/studying? ,What made you choose this course(program)?,"Is your chosen course/program your first preference? If not, what was it?",What are the factors or circumstances that influenced you to change your preference? ,What are your short-term future career plans? ,"In the current competitive scenario, how stressful do you feel on a scale of 10",How do you manage your stress?,Is the present examination pattern assessing the student’s knowledge appropriate? Share your thoughts.,Provide your views on university entrance examinations,"Rank based on preference the following teaching methods on a scale of 1-5 (1-Most preferable,5-least)
For example: If flipped classroom is given 1 then the other methods cannot have the preference 1. Active learning 2, Gamified 3 etc. Do not repeat the ranks. [Flipped class room – Reverse of traditional lectures. The lecture materials are read at home and self-learnt and problems are solved and doubts are cleared in classrooms.]","Rank based on preference the following teaching methods on a scale of 1-5 (1-Most preferable,5-least)
For example: If flipped classroom is given 1 then the other methods cannot have the preference 1. Active learning 2, Gamified 3 etc. Do not repeat the ranks. [Active learning: It’s a group-based learning. Active learning methods ask students to engage in           their learning by thinking, discussing, investigating, and creating.]","Rank based on preference the following teaching methods on a scale of 1-5 (1-Most preferable,5-least)
For example: If flipped classroom is given 1 then the other methods cannot have the preference 1. Active learning 2, Gamified 3 etc. Do not repeat the ranks. [Learning through doing projects and engages them with real life problems.]","Rank based on preference the following teaching methods on a scale of 1-5 (1-Most preferable,5-least)
For example: If flipped classroom is given 1 then the other methods cannot have the preference 1. Active learning 2, Gamified 3 etc. Do not repeat the ranks. [Hands-on-learning means learning by doing.]","Rank based on preference the following teaching methods on a scale of 1-5 (1-Most preferable,5-least)
For example: If flipped classroom is given 1 then the other methods cannot have the preference 1. Active learning 2, Gamified 3 etc. Do not repeat the ranks. [Gamified learning- Gamification in learning involves using game-based elements such as point scoring, peer competition, team work, score tables to drive engagement, help students assimilate new information and test their knowledge.]",How comfortably you learn on a scale of 1 to 10 when an instructor or friend explains the concept,"How comfortably you learn on a scale of 1 to 10 when   you self-learn using resources like online materials or videos, books, and resources.",What is your definition of success?,What do you want to achieve with your education?,"What are your suggestions to improve India’s education system to make it more knowledgeable and enjoyable?
 ",What is the reason behind your first preference?
10-01-2022 09:43,18,Female,Class 12,6/18/2022,Yes,My interest in Mathematics and Physics. ,"If not for BTech, I wanted to do Pure Mathematics in ISI or IISER.","I felt that, I can do courses later, or come up with my theories in Mathematics. But once I take up Mathematics, I cannot change to BTech.","After my PG, I want a satisfactory job, with decent salary, in my domain. ",8,"Music, dance, sports. ","The descriptive method of examinations, is truly not the right way to assess a student's knowledge. Many students screw up their exams inspite of being intellectual. On the other hand, there are low scorers who understand the real life problems better than the toppers. But, everyone needs to have an examination as a basic test to each one's smartness. ","It may look like a discrimination, but it's an absolute necessity. As mentioned above, to test the basic skills of a student, University has to keep entrance examinations. Reservations is the only bad thing in India. They have to be removed. Reservations based on economic background, is understandable, not the rest. ",4,4,1,5,3,8,7,Being happy with whatever I'm doing. ,"I am looking forward to a decent job, and maybe come up with my startup. I have dreams of helping India and it's society in the near future, in many ways. ","Lakhs of parents in India, want their kids to be engineers or doctors. Hence, the competition here, is not healthy at all. Every institution is just hungry of ranks and do not ever look at the mental strength of each student. In many countries, extra curricular like music, literature, art, dance etc are given a lot of importance. There are considered as different subjects, whereas in India it's just an extra curricular activity. Many Indian parents, don't even let their children to pursue these, because they don't want them to defocus from their major subject. This has to change. Instead of always studying, students have to get engaged in real life problems, and must know how to deal with them. By hearting won't lead them anywhere. ",
10-01-2022 09:51,24,Male,Msc Data Science,6/16/2023,Yes i am happy that i am studying data science,It's  a high paying job,Yes ,More employment opportunities,Leading my team where i m working,8,"Playing sports, listening music, spending time with friends",Sometimes yes sometimes no. When there is back to back exams it's very Stressful but student somehow manages it. ,Entrance exam is very important according to me. If u didn't score well in boards u can study to crack entrance. ,3,1,1,1,1,7,8,If i am and people around me r happy,To help others ,"Make it practical knowledge
Real life implementation is necessary
",
10-04-2022 13:12,18,Male,12th,07-01-2022,Yes,Passion and partly ambition,Same course in a better institute,Brutal competition,MBA in IIM,2,Distract from it by engaging in other things,No. The impetus on memory and outdated application based testing retards the readiness of the student to the industry expectations. ,They're pretty well made appropriately for the institute ,3,2,2,2,3,8,6,"Stability in career and mental state,self sufficiency
","Success as explained before
",Focus on collaboration than competition ,
10-04-2022 13:13,17,Female,12th Std,10/21/2004,Yes,The interest to exploremore in this field,Yes,"The competitive atmosphere around me, and the need to be on top to succeed","Get into a corporate for about a year or two, and then pursue higher studies",8,"Try to talk to the people I'm close to, more often and take small breaks","It most definitely is not appropriate, I assume it is better to have an examination pattern that is more individualistic, rather than generalizing it.
Not all students are the same and each one's strengths lie in different areas
While there is a requirement of the examination pattern to be fair, I also think we need to come up with a better way of assessing students' knowledge","It may not be a right way of choosing people based solely on their performance in a single examination
Entrance into a university should be holistic and not  based off of just an examination
As much as it is important to be smart, it is equally important to have other traits that'll help them succeed in life.
Smartness isn't the only measure of success
",1,2,3,3,4,8,9,"Success in my words is something that has you satisfied with where you are in life.
If you feel you're able to satisfy your needs, with something to spare and you're happy. that is mote than enough for you to achieve ""success""",Try and contribute to all the developments and advancements that are happening in this rapidly changing world,"1.The concept of coaching institutes should not be a thing.
2. Instead of having 2 different things over the same topics, viz. Board exams, and Competitive exams, it is better to come up with something that has your aptitude working, while also enhancing your concept understanding
3. More time should be given for self study, and not just teaching in a classroom.
4. The exam pattern of board examinations should change, instead of expecting descriptive answers in exact words, creative freedom should be given to students, given that it is a subjective examination",
10-04-2022 13:28,22,Female,12,5/15/2018,Kind of,I din't get MBBS seat,"No, it wasn't. MBBS was my first preference ",Less medical seats,Surgeon ,10,I indulge in my hobbies ,No not at all. It's all other than what is required ,They should stop assigning marks based on length of an answer and honestly look for the standpoints it contains. ,4,3,1,1,1,10,9,Having the highest knowledge in order to fullfill the purpose of your career & serve humanity ,I want to be a best physician. Overall a Best Surgeon ,Practical learning should be prioritised than theory learning. Provide stipends to interns who work day & night. Seats shouldn't be distributed based on Money but with results only. ,
10-04-2022 13:35,22,Female,Mbbs,2/22/2024,Yes,I was passionate,Yes,No factors,Thinking of business,8,"Playing, and participating in intercollegiate events",Yes,Needs improvement,3,3,3,3,1,4,9,Consistent smart work and resistant to leisure activities,Good medical support for the needy,"Practical based education system
Group projects
",
10-04-2022 14:46,18,Male,12th passout(pcmc),6/18/2022,Yes,"Interest for the subjects, and the field has the most opportunities for college and further studies and jobs.",Yes,None,"Finish college and look for a job, before planning anything else",4,"Don't think of the exam as a do or die situation, rather consider it as an opportunity, and if you don't succeed you'll have many other ones.","It might not be the most ideal one, but it's the perfect one for the correct scenario. As long as education develops at the grassroot levels, no other changes can be made","They've their pros and cons, while most times you get intelligent and hard working students. Sometimes there are students who don't have a deep understanding of certain topics but by by hearting formulae, they can ace such exams.",2,3,3,3,3,7,8,"Reaching a position where you are content with what you have.
Also realising ones potential and trying your best to achieve it.","Keeps the mind running, and getting real world skills. Also meeting like minded people and having a good network.","Teachers should be less rigid, i.e. shouldn't think that their method is the best. Rather they should experiment various methods so that the students learn in the best way possible
",
10-04-2022 14:47,21,Female,Physiotherapy ,10-04-2022,Yes,With self interest ,My interest was in medical field ,Some problem in college ,Wanna be dancer,4,Listening to song or dancing ,Yes,Good,3,1,1,2,2,5,6,Success is when we feel happy with job what we have ,Good physiotherapist ,Let children work in there interested field ,
10-04-2022 17:56,19,Female,Bsc. Psychology ,5/23/2023,yes,i was interested to understand myself and the ways of human nature ,"this was my first preference, yes. ",NA,"i can barely get through this degree much less think about career plans. if things go well, i want to work as a child psychologist ",10,i don’t. i deal with it terribly. i procrastinate. running away from my problems is how i deal with them. ,it really isn’t. we are just expected to learn a bunch of facts and vomit it out in the exam. i want to apply my knowledge somewhere. i want to answer application based questions. ,"as long as the questions are application based, they are justified ",4,5,5,5,5,8,10,being contented with what you are doing while having no qualms about what the others will say,self-confidence. ,"the entire system needs to change. the methods of teaching, testing and judging are outdated. hands on learning needs to be promoted. ",
10-04-2022 18:02,20,Female,(UG) B.Sc Psychology ,4/30/2023,50/50,Interest in subject,Yes,N/A,M.Sc clinical psychology ,8,Focusing on what's important ,"No it is not. It assesses your ability to memorise content only. Which is why students struggle when put in a practical application situation, wherein they need to concert the theory to practice on spot, with no prior training for the same.","Entrance tests for master's courses seem beneficial. They are fine, but the test should be relevant to the choice of course. Expecting a student applying for psychology to write an entrance exam testing mathematical reasoning is irrelevant to the student. 
But entrance tests for under graduation seem pointless due to the insurmountable pressure put on students for scoring in higher secondary schooling. NEET/ JEE exams are only pressurising, and have a very thin chance of passing for most applicants. Either don't make 12th scores that important, so that kids can primarily focus on University entrances, or give admission based on 12th scores. 

But the imminent problem is not any of the above, but to make the quality of education equal everywhere. Every child should have the same access. ",4,5,5,5,4,7,9,Achieving your potential. ,Strong foundation of knowledge ,"1. Practical application > theory
2. Worksheets, peer-learning forms of assessment that test ability to learn and apply, instead of memory tests. 
3. Freedom to reason and explain choices (instead of having fixed answers) basically encouraging perspectives
4. Providing wide range of options for study
5. Freedom to choose subjects. ",
10-04-2022 18:16,20,Female,B.Sc. Psychology ,05-01-2023,yes. very happy.,Career counseling,No. It was designing,"Career counseling, COVID",Masters in psychology,5,"Engage in sports, sleep",No. it is mainly theoretical and very impractical sometimes,"There was no entrance examination as such for me. it was purely based on my 12th CBSE score. I don't think it's an effective strategy to filter out students for this course, considering the fact that my 12th course didn't even have psychology as a subject. And i might have ended up having more aptitude for computer science and other science based subjects like physics and chemistry. ",1,3,2,3,3,10,9,"Being able to fully understand the concept and be satisfied with my level of knowledge about it, and also be able to answer any question relating to it. ",Help people,"Make it more practical and rule out rote learning(as only some people are good at rote learning while the others find it difficult to memorize thinks verbatum, and it is very unfair to them. ",
10-04-2022 20:06,21,Female,Computer Science ,6/30/2021,Yes,Personal Interest ,"No, My first preference was BE in CSE",Didn't get the seat in preferred college ,Want to work in a MNC in a developer profile ,8,By doing things i like ,It's mostly assessing our memorisation power and not the knowledge about the subject ,Some University exams are for name sake,4,3,1,1,1,9,9,Success is when we are self satisfied with whatever we are having and doing ,"All i want to achieve with my education is the independence or power to solve my problems on my own, and education gives that confidence to solve most problems by ourselves, and i want to achieve that confidence ","Make it reality based, more exposure to industrial real time projects. The more real time projects we do the more knowledge we will have on that subject.",
10-04-2022 23:03,22,Female,MSc business statistics ,5/30/2023,"Yes, I have chosen this subject based on my further plans.",I wanted to write actuaries paper and this subject was something which could help me achieve it.,"Yes, I wanted to pursue statistics as base and wanted to learn business as part of interest. ",Din't change preferences. ,For now just going in flow no plans so far. ,8,By talking with friends or exploring outside. ,"No, although exam need to conducted for our knowledge (I.e. how fat have we learnt and understood things). But feels like now q days exam is conducted only for marks.",Now that marks play major role. I feel the student who have the domain knowledge that they want to take isn't helping them to complete exam let it be whatsoever exam it is. ,4,5,5,4,4,8,9,Doing something that's impossible ,Nothing ,"1. Rather than following earlier english learning except them to follow indian traditional learning. 
2. Enjoy learning and studying not marks (don't let marks define your future or yourself)",
10-05-2022 09:36,23,Female,Msc in applied microbiology ,06-10-2023,Yes,It's quite interesting and always wants human resources ,Banking,Lack of government jobs and most probably the quota system,"Microbiologist, teacher",9,By distracting my self by doing my fav activities ,"I guess it's not
 It is more theoretical than practical ",I didn't have,3,2,1,3,1,7,9,Being happy with doing a work of own interests ,A job,Just kickoff the quota system,
10-07-2022 11:24,22,Male,Engineering Graduate ,08-01-2022,Yes,The never ending drill,Yes,NA,Hands on technology scale,5,By segregation of tasks ,Yes everything is great but again it's a people's perspective kind of thing,Looks good but home quota is a bizarre thing to have,4,4,5,5,3,7,8,That there is no pushing own self to get the work done at any point during the day,Impact all sections of the society be it rich poor big small far near ...anyone,Have less number of students in a class to focus more on each,
10-07-2022 11:55,21,Female,M.sc. Biotechnology ,05-04-2024,Yes,I love biology and i also learnt about biotech from my 12th biology book and it made me curious to learn and explore more in this field ,Yes,-,To get a job ,9,Sharing and venting it out how I'm feeling to my friends and family,"No. Exams are mark biased. I sometimes feel like to get good marks we just blindly read the lecture, without understanding the concepts because people don't value knowledge as much as they do for marks.",I haven't written one,3,3,5,5,4,6,9,Minimum efforts everyday ,No Idea ,#NAME?,
10-07-2022 16:13,24,Male,MSc Data Science ,5/13/2023,probably not to say,enthusiasm for upcoming or generating data,yes,"Google ADs , Big Data Analytics",Being a House Husband,9,"Guitar , Music , Solitude , Basketball",nope they are just assessing our mugging up powers ,never gave one so nope,3,3,2,2,4,8,9,Being Haapy and Unjudged ,some Knowledge which is applicable and basically happiness is what i seek,"please provide good teachers who have a passion for teaching, not just those who are here for salaries 
Please provide a specialization of any course at younger age so that the person might know what he wants at younger age and wont suffer after years of education",
10-07-2022 20:50,22,Female,Bsc,6/30/2021,Yes,My interest ,1st preference ,Society ,Data Analytics ,10,Diverting and going out,I personally don't think so. Its just testing the memory power,One exam cant decide the ability of person and many lost their career bcz of this,5,5,5,5,4,8,5,Follow your dream ,Teach the Society ,Do n learn will help more than the text book learning and all people are not same we cant judge the ability of fish by its tree climbing strength so I believe everyone has their own abilities with which they can shine. Teaching should be like to bring their talents out.,
10-07-2022 23:24,22,Male,M.Sc Data Science ,5/17/2023,No,Scope for job,Yes,Nil,Be strong I fundamentals required for career ,8,Take a break to diverte,"No,  The is not brought out from students ",Nil,1,3,1,1,1,10,10,Living up to self expectations ,Self content ,"Reverse engineering,  student should know why the subject is required rather teaching the subject with out telling what's the goal for the subject ",
10-08-2022 06:47,22,Female,Btech in electronics and communication ,05-10-2022,Yes,Flexibility of job opportunities ,"No, biotechnology ",The number of colleges providing this course was less ,Completing my masters degree,8,Talk to friends and family ,It depends from college to college in a country like india. There are universities whose exam patterns can be top notch and really be assessing the students knowledge but some universities are just conducting exams name sake ,They are much needed as they truly assess the potential of students ,4,5,4,5,5,9,7,"To be successful is to be confident with ones own skills that is built in a course of time and be the best at it , while enjoying it ",Self sustainability and peace of mind ,Make it student friendly ,
10-08-2022 14:59,22,Female,msc data science,06-08-2023,yes,Personal interest,yes,na,Job,4,Singing,Yes,Nil,1,5,2,3,4,7,7,Seld-dependent,Independence,Student-friendly,
10-08-2022 21:49,24,Female,Mtech,06-01-2023,Yes,I wanted to pursue masters from a college  with good lab facilities. ,Yes,Nil,Completing my master thesis,10,Eating n watching netflix,Nope,Pressurising,5,4,3,2,1,10,9,Being happy n satisisfied. ,Be a good person. ,More practical approach than theoritical. ,I liked the course
10-08-2022 21:50,22,Female,MSc,06-01-2023,No,Name of the college and name of the mentioned subjects in the course,MSc applied Statistics from symbiosis pune,The course fee and name of college ,Currently job for a couple of years,5,Songs dance exercises and laughter,No they rather assess my memory. I want it more project based where we apply what we learn but this is more just focused on typical school work and not of a PG course,They seem to be okay if they are fair ,4,2,3,1,5,7,9,Satisfaction and sense of contribution along with monetary gains is success,"Let's be honest, I want to achieve the career for which I chose this course and have a better package for which I chose this college.","Practice, interactive sessions, projects, hands on , minimum blackboard lecs and more practicals",Traditional lectures if teacher isn't interested makes everything boring and makes you hate the subject. It has its pros but then no creativity and action makes lectures boring uninteresting.
10-08-2022 21:52,22,Female,M.tech,10-08-2023,Yes,Interest,Yes,Nil,Get a high salary job,7,Controlling myself,Yeah. Out of box questions trigger the inner knowledge of us,"Its good . But when some of them get rank by copying, that creates an issue.",1,2,3,4,5,9,6,Proud words from my parents and closed ones,Knowledge ,Marks make the students stressed. We should not market them. ,My own interest 
10-08-2022 21:53,21,Female,B.E in CS,7/20/2022,Fine,Interest in technology ,Yes it was,None,To work with new technologies ,7,Netflix - movies,Not really. Need more logical approach for assessments.,Very rigid.,4,3,1,2,5,7,8,Mental peace ,Capability to do tasks by myself without anyone's assistance.,Stop pressuring students to get good marks. Focus more on teaching based on practical approach. ,Nothing in specific 
10-08-2022 21:55,21,Male,BSc (hons) Horticulture ,09-12-2022,Yes,Wanted to do unique ,"Yes, it was the first preference ",Nothing ,Still in confusion ,9,Drawing ,I don't think so. It's all about reservation ,It's kind of good,1,2,3,5,4,8,6,When other notify your good works and yours satisfaction ,I just wanted show I'm capable of doing anything ,"Reduce the reservations, so that may average students also get more chances",I wanted to be different 
10-08-2022 22:01,18,Male,Ii PUC,08-10-2022,Yes,Interest in said course,It was,----,Study well in xollege,2,I game ,"No, it isn't.",Hard to crack ,1,2,4,3,5,8,8,Doing something you love while earning enough ,A job I'll enjoy,Make it more hands-on. More learning on activities.,Seems like what would benefit a student 
10-08-2022 22:02,23,Female,Data Science,07-10-2023,No,"The name ""Data Science"" and the university VIT",M.Sc(Stastics) in Delhi University,Did not get selected in Delhi University,To earn 12-15 lakhs per annum,10,Try meditation,No. Just cramming the concepts and writing it on a sheet of paper does not improve the knowledge of a student,The theoritical part that university entrance examinations has does not imply that the student has a good knowledge of the subjects. ,1,3,4,5,2,8,10,A person is successful when he inspires others to be a better person.,To earn good and to make my parents proud of me,More interactive and more hands on training ,I think that the students will be able to learn at their own pace and then clarify their doubts easily from their teachers
10-08-2022 22:07,22,Male,Data Science ,06-12-2023,Yes ,For situation. ,Cybersecurity. ,Money. ,Become a good data analyst ,7,"Talking with friends, and playing games. ",Yes may be,Yeah it's good only. ,1,2,3,4,5,6,8,Money,Good position of job,Remove the fear of examinations. ,My interest 
10-08-2022 22:12,23,Female,Msc Business Statistics ,06-07-2023,yes,My internet of study,Yes,Staff and criculaum,Get place in good company ,8,Watching web series and Comedy shows,No,It should based on which course you chosse and overall knowledge,1,5,2,4,3,5,6,You should know deep knowlegde about basic as well as important concepts ,More application based knowledge,Make to more application based,No reason 
10-08-2022 22:12,22,Female,Mbbs,7/19/2000,No,Peer pressure,I wssnt clear about anything ,Parental pressure,Complete mbbs,10,Yoga,No,They r gpod but students should be given right orientation  ahout it,1,2,3,4,5,10,8,Happiness in work,Monetary freedom ..happiness in serving others,More practical based learning ,I didnt understand the question 
10-08-2022 22:15,21,Female,Bsc.Computer science ,05-12-2021,Yes,The booming growth of data science students and the demand for data scientist all across globe .,Yes ,No i didn't change ,To be a well versed data scientist in a company,7,By reading books and listening music,It's partial. Like we need more knowledge onhow to implement what we study .,There is no entrance exam for our course,3,2,4,5,1,9,10,To become a better version of myself than yesterday ,To be an entrepreneur ,To change the obsession with grades and marks and increase the practical knowledge of the particular field that the student is interested in .,Because I was interested in data science 
