10-08-2022 22:16,21,Male,MSc Data Science,07-01-2023,Yes,Interest towards the subject statistics,No my first preference was MSc Statistics,Lack of Jobs for Statistics Post Graduates,"In the present situation of recession, somehow get an IT related Job, later on I guess my MSc Degree along with the experien e in the industry will be useful for me to get my Dream Role(Data Analyst)",10,I am unable to manage it.,"What I feel is curriculum is not at all correlating with what is required in the industry, I think that must be changed.",Post Covid many universities started giving admissions only based on Under Graduation/12 th Marks which must be changed. Entrance exam syllabus must be specific to the course(not generic),5,3,2,4,1,6,9,"If you are the living your life the way you aspired/dreamt of, that is Success for me",A Decent Job and Respect from the Society,Faculty Student interaction should improve,Gamified Learning is the one which I prefer which I think the current generation will be comfortable
10-08-2022 22:16,21,Female,M.Sc Data Science ,5/30/2023,Yes ,"I’m very enthusiast person towards collecting data, processing and knowing the outcomes and my favourite subject is statistics these made me chosen Data Science",Yes it was my first preference ,I didn’t changed my preference ,To become a Data Analyst ,7,"Yoga, Badminton",As my point of view they can change some aspects in examinations if it happened may it would be an appropriate ,It was good attempting an University Exam,5,1,2,3,4,10,8,Hard work and Smart work,Winning a university competition in badminton ,Don’t give class room knowledge to students relate the problems to real life and teach them how they are Turning out to be,Fond of Statistics and dealing with data
10-08-2022 22:17,23,Female,M.sc Datascience ,6/15/2023,Yes,Because these day where ever you data is generating so it is quite good to learn about data analysis ,Yes,No,As of to get in to a good data science company ,7,Listening to music,Exams and marks doesn't matter knowledge is more important ,It is good to conduct entrance exam so below average can't get in to that course and we will have less competition,4,2,3,1,5,8,7,Learn and get knowledge ,Good knowledge ,More more example of real projects or ask us to do projects on the subject what we learn during course ,I choose my comfort 
10-08-2022 22:17,23,Male,Msc Data Science ,8/30/2023,Yes,Data related things ,Yes,None,To be a data analyst and streamer,5,Games or series ,Yes it is because it is forcing you study all the topics somehow so you can increase your knowledge ,NIL,2,1,3,4,5,7,9,To reach my goal which is to get a decent job where I can fulfill my requirements and to become a good gamer and streamer ,To become a good human being who may be not good academically but good as a human being,Try to make courses which are more interactive so people will show eagerness to learn and also for everything show practical exam so people can implement those in real life,It’s fun to play with data and know more about data
10-08-2022 22:18,28,Male,Msc Data Science ,6/30/2023,Neutral,Career prospects,Yes,Better career,Internship,6,Music,Not all all appropriate. Its too academic and less practical. ,It only assess one aspect of intellect.,1,2,3,4,5,6,9,Independence and financial freedom. ,Financial freedom,More hands on and custom catered to each students skillset.,Career
10-08-2022 22:22,21,Male,Pursuing MBBS,3/24/2025,Yes,Inspiration from a teacher,"No, first I wanted to do something in science and engineering ",A 45 min class from my biology teacher ,Be a competent and knowledgeable clinician,8,"I don't know, probably overeating.... and I know it's bad",Naah. Writing subjective answers does no good. Objective exams always. They test you in and out and I feel they are the most effective way to assess a student and practical exams need way more attention and importance. Probably more than theory exams.,Good but a lot of things must improve,3,1,5,2,4,4,10,Being happy,The unthinkable ,Making the objective of education system Learning rather than studying. ,Simple.... active learing= longer retention.  You make your brain work in the most effective way
10-08-2022 22:27,20,Female,BSc EMS,08-01-2022,yes,for its opportunities and on demand career scope ,my first preference was to take cms having a computer background,peoples opinion on economics and the ever demand on it made me change my preference.,land in a data analyst role in a well known company ,6,"read novels, have a nature walk, and stare endlessly towards the sky",if the pattern had much more practical and industry based questions where you actually apply what we've leant would be a better way to conduct exams,not sure on this,1,2,4,5,3,8,5,when a person keeps trying even after successive failure. your effort and the willingness to keep going is success ,a meaningful life that i did justice to what i studied,"make it more practical
explain why certain things are in certain ways
have memory games
have games that include both your physical and mental games combined.",anything practical helps you understand better
10-08-2022 22:29,22,Female,Msc ,07-05-2023,Yes,Job oriented ,Yes,NA,Internship and a job ,5,Talking to mother ,Ok ok ,Nothing much ,5,2,3,4,1,9,7,To take care of my family ,Job ,Need practical knowledge ,Job oriented course 
10-08-2022 22:30,22,Female,Bsc(CME),10-08-2022,Yes,more innovative,yes,the combination,to be achiever,9,Spend time with family,Instead of keeping more questions it should be less no of questions which can cover more entire syllabus,50-50,1,2,3,5,4,10,10,Raising from failure,Everything possible,make it more practical,Maybe thought
10-08-2022 22:30,22,Female,Data Science ,6/13/2023,yes,Had a background of Statistics... so going with the most emerging felt like a good option. ,Applied Statistics ,number of seats are very less for applied and colleges as well,earning as much as I can,8,talking with friends ,somewhat yes,it's very different in direction than what we are taught to,4,2,1,3,5,7,8,Able to manage all the things in life without stress or frustration over basic need. And provide settled life to yourself and family. ,That's a Secret! ,Over intake of students shouldn't be there. And instead of workload should teach with practical things and engage students with knowledge ,As facing the reality of world ... we can clearly see how much important it is to learn practical things over theoretical 
10-08-2022 22:32,22,Male,BCA,8/28/2020,Nope,"Parents told to apply for this course and that time
I have no idea about college studies. ",At that time i was planning to join BE.,Parents and family people advised me a lot that not to join BE,To Become a successful Data analyst or Data engineer ,7,"Whenever I face stressed, that time I use to go for sleep",Yes it is!,All university should have to conduct entrance exam to check the capacity of the student.,5,4,3,2,1,8,10,"Work hard in silence let your success make noise. 
No more excuses. All great and precious things are lonely. Don't be afraid to give up the good and to go for the great. ",To become a Good human being on this planet earth 🌏 ,Vote for aam aadmi party.,Do get knowledge 
10-08-2022 22:38,22,Male,Msc,06-05-2023,Yes,Passion ,Yes,My passion towards physics ,To complete my course successfully ,8,Sleeping ,No. There is a lot of scope for improvement ,Barbaric and treacherous ,1,2,4,3,5,9,6,Success is when you are compared as an example rather than told about other examples,For a better world ,Well to reduce the competition in one field and equal opportunity in all the fields. And not to discriminate the students by the course they take and how much content they can memorize. ,Personal choice 
10-08-2022 22:40,22,Female,Genetics,06-01-2023,Yes,Interest in Diseases,Definitely yes!,Nothing.,Researcher,10,YouTube.,Yes.,It's useful to some extent.,3,4,1,2,5,8,8,Being happy.,Contribute to the cue of diseases.,Give more assignments that involve research related work or reading research papers.,It's easier to understand the current scenario. 
10-08-2022 22:42,23,Female,Data science ,6/30/2023,Yes,Job opportunity ,Statistics ,New field of learning ,To be placed and learn more,5,Hearing music ,It's going good ,Only thus we can know our level of knowledge ,2,3,4,1,5,8,6,Hardwork & smartwork,Learn more ,Practical knowledge should be encouraged ,It should be practiced 
10-08-2022 22:43,22,Male,M. Sc. Data Science ,06-01-2023,Yes,Because this technology is emerging in computer field and in this field career future is good. ,Yes,NA,Get job in good company ,5,"Listening music, playing game, etc. ",Definitely not. It is mostly about how much you can mug up before the exam day rather than actually applying the concept. ,It's really good level of entrance exam,2,1,3,4,5,8,9,"If I achieve what I want to and are happy, then I think that is success. ","I want to gain knowledge, skills and experience to help you both in your career and in life in general. ","Better Standards, Parent Involvement, Periodic Assessments, Skill based Learning, etc. ","Had a inclination towards finding insights, hence ended up taking data science. 
"
10-08-2022 22:44,21,Female,Msc Data Science ,10-08-2023,Yeah.. it's great,Python,Yah it's my first preference ,Interest of computer knowledge ,To be placed data analyst domain company ,3,Just relax to hear some songs,Yah it's good but the efficient knowlegde like SQL and DBMS are to be included in syllabus is more useful to prepare placement exam for students ,It's good way to get more knowledge ,1,2,3,4,5,9,9,To get satisfaction with honesty ,To get more knowledge and placed a higher position company ,The way of education will be more understable to teach the way to connect with real life examples.,Interest of programming language 
10-08-2022 22:44,22,Female,Msc Data science ,5/31/2023,Somewhat ,Job opportunities ,Yes,I preferred Data science because of salary scope.,To get a high paying job and achieve a leading role in the industry.,5,"By watching Anime. And remembering what ever is meant for me will eventually come to me, no need to rush and be on stress.","No, the examination pattern which grades and gives marks are impractical. Constructive project and team work activities and individual development activities are better for development of a student and it's more helpful in knowledge building. Marks never reflect the capability of students. ",Entrance exam are just a means of convince to select only a particular number of students based on marks. And marks has become more important now than actually gaining practical knowledge.,5,4,3,1,2,5,10,"Success is when you prosper in all directions of life from health, wealth, family relations and happiness. Success is when you believe in yourself and live out the best version of yourself.","Education is just the foundation of life what is important is what I build on it, and what I want to achieve is my definition of success.","Being practical, hands on learning, activities and instead of grades or marks, it should be feedbacks. Attempting all questions is impressive, but attempting only one question with impressive answers is also an achievement. Remember in the time of sages, where marking system didn't exist people travelled to gain real knowledge and knowledge acquired then wasn't some kind of roat learning it was a kind of knowledge which was impressed on there mind and heart.","Hands on learning is the best, knowledge with knowing how to apply is useless. How do learn to cook and become expert at it , by actually doing it and not just watching YouTube videos and reading recipe books."
10-08-2022 22:45,21,Male,BE aerospace,8/20/2023,Yes,Childhood passion,Yes it is,None,Look out for universities abroad,6,"Reading books, social meetings and distractions","Not at all, its very bland and monotonous","They are good, but needs more malleability to improve the way they are assessed",2,3,4,5,1,8,9,When a fish can climb a tree?,add value to the existing industry and see the old techniques evolve ,Take into account all the students and not just the society's cream,"No specific reason, just interest"
10-08-2022 22:46,22,Male,Master's in Data Science,07-01-2023,Yes,It is one of the most sorted out job,No,"Time, Cost",Get a job as a Business Analyst or a Data Analyst,6,By taking proper rest and giving time to brain and body to refresh.,"No, the current examination pattern is somewhat more in favour of average and weak students.",It is a must so as to filter out students who really want to do something from those who are just sitting for getting a job,1,2,4,3,5,10,6,Success is when you are able to achieve something which is even better than your expectations.,I want every single thing that I have learnt to be applied somewhere or the other in my life.,"First of all, not failing in lower standards should be avoided because the mindset of the students become such that when pressure will come at a later stage they might not be able to tackle it.
Secondly, rather than going behind theoretical concepts, things should be related to daily life examples and studying from images, videos, animations etc should be increased to make study enjoyable for the students.","Because all the human brains are designed to work more efficiently when they are stress-free. Also, gaming, video explanations etc are more likely to make concepts clear easily."
10-08-2022 22:47,21,Female,Msc datascience,5/21/2023,Yes,Job opportunities,Yes,Datascience is my 1st preference,To get placed in core company and gain knowledge about my domain,9,Rewatching favourite movie /series. Listening to music ,No.,"It's important ,as it will qualify the students those who can handle the subject . Passionate students will given more chances. ",5,4,2,3,1,9,7,A peace life with satisfaction.,Knowledge about my domain with decent package ,"More Pratical classes.
Practical explanations for each topic.
No book back questions during the final exams.
Project based learning 
",Upcoming domain with more job opportunities 
10-08-2022 22:47,26,Male,Msc. Data Science,6/30/2023,No,Area of Interest,Yes,NA,Job,8,Watching Anime,"No, It isn't. ",NA,5,3,1,2,4,9,8,Inspiring to do more.,Applications of Knowledge.,Conceptual Teaching and not focusing on scoring marks.,I like to Analyse Data.
10-08-2022 22:50,22,Male,MSc in Data Science ,6/20/2023,Yes,Because This is one of the best colleges that provides this program ,Yes,I got my preference ,To be in one of the top MNCs as a Manager in the next few years,10,By talking to your closed ones,Yes.It is appropriate but it can more challenging in terms of validation of skills.,University Entrance Examinations are really competitive and up to date.,1,4,3,2,5,6,8,To be financially independent and emotionally healthy before reaching an age of 40.,I want to achieve a successful career in my professional domain and be a high rational person.,To make it more practical and interactive.,Because we really need to change the traditional approach as we move ahead with time.
10-08-2022 22:50,24,Female,Industrial design ,06-01-2023,Yes,My passion for design ,Yes,NA,Start up,10,By eating a lot,I think it’s testing our memory more which shouldn’t be the only thing to test,Very stressful ,2,3,1,5,4,8,4,To be able to afford all the things I like,Growth in knowledge ,We should normalize home schooling or hybrid ,I think it’s more practical 
10-08-2022 22:50,23,Male,MSc Data Science ,6/30/2023,No,Because it's one of the best colleges in India that provides this course,Yes. I had no other option.,NA,To work with top MNCs.,10,Talking to my closed ones.,No. It doesn't assess a student's skills,It's a good way to shortlist skilled candidates,5,4,1,2,3,6,9,It's the learning you achieve from the journey,I want to achieve great experiences in life and also want to educate other people.,Introduce projects to build instead of taking 3 hour long exams.,Real world use cases help a student to understand how businesses work.
10-08-2022 22:51,21,Female,Data science ,7/31/2023,Yes,Knowledge and know about this new upcoming field,Yes it's my first preference ,Nothing ,Explore myself and know about people.,8,When I get stress I used to go out and play ,Yes it's good it can be enough to know that how knowledgeable a student is.,It's a good way to get a good skill students.,4,2,3,5,1,7,9,To achieve goal.,A good place in company in which I got placed.,"Interactive sessions , group discussions, Active participation. ",I want to explore in this field.
10-08-2022 22:54,23,Male,MBBS,2/16/2024,Yes,Passion to become a doctor ,Yes 1st preference ,NA,To become a surgeon ,10,Taking breaks at regular intervals ,50 50 call,Standard ,1,2,3,4,5,10,8,Achieving the small goals u set daily ,Help people ,The current education system is great ,Passion 
10-08-2022 22:58,22,Male,MSc Data Science,7/31/2023,Yes,"Enthusiasm to learn about data, ML, AI, DL and Data Science as a whole","no, 1, MSc Computer Science or MSc Data Science in IIT, 2. MSc Computer Science from CMI, 3 .MCA in NIT College, 4. MSc Data Science Vellore",Could not pass in other exams.,To get good quality knowledge on Data Science.,9,"Work, study to improve my skill",yes and kind of no also there can be some other ways to asses the students knowledge.,University Entrance exam must not only be just a test but it should also include other activity like interview and some other skill based practical test to asses whether the student is fit for the course or not.,4,5,1,2,3,10,10,when you are happy with what you are doing and have impacted positively to a persons life.,"To solve problem of people, organization and spread what you have learnt.","There is a lot to change the exam, the way of teaching, the way of assessing a student and behavior of each and every individual within the boundary of the institute to be positive and calm.",College And teaching
10-08-2022 23:00,23,Female,M.Sc. biomedical genetics ,5/20/2023,No,Interest for the subject and to learn new things,Neuroscience or reproductive- development biology ,Didn't get into college of choice/ course not offered in India in most colleges,Get proper lab experience ,9,I procrastinate and then break down under the pressure ,"Nope. In my field, practical experience is more relevant.. learning through performing and current exam patterns don't really help",They could have a different pattern which doesn't just test book knowledge. Not denying it's importance but it's not all thats there. It's learning without execution ( in specific to my field of study),4,3,2,1,5,6,8,Understanding and executing an action and being able to question the result and build on it ,Curiosity as to why I am doing what I am doing and how can I do it better. I want to learn how to do what I'm doing better,"More open practical experiences. Removing the ""force factor"" of studying. I.e. attendance requirements and need to complete x credits in x years. Maybe adopt the portion of foreign education system that allows one to take a break from their current education to work and then resume from where they stopped. This will allow people to explore what their field has to offer while studying so they know they're making a right career choice without wasting time. This also allows them to explore completely unrelated career paths to what they're studying. ",Practical learning shows where a person is in real world situations in my field
10-08-2022 23:00,21,Female,Masters,05-02-2023,Yes,Career and interest ,Yes,Maybe job opportunity ,Final year project with 1st class course completion ,8,Watch kdrama and Listen to music ,Not really ,Difficult ,4,3,2,1,5,9,8,Achieving what I planned to attain ,Highly paid job with comfortable workplace ,Reduce mark based treatment and improve practical knowledge ,Dream career
10-08-2022 23:02,21,Female,MBA General ,3/31/2024,Yes,The exposure it gives,Yes,I did not change preference,A well paid corporate job in the field of business analytics,9,Hustle ,I believe a continuous assessment will be more efficient than an end term examination as it will tap the students’ knowledge better,They sometimes fail to recognise truly bright students.,5,1,4,2,3,9,8,Doing a job that you like,Views of more perspectives and imbibing soft skills,To have more discussion based learning and hands on learning,This is the method followed by the professors in my college and it has been very effective as it helps students broaden their thinking.
10-08-2022 23:03,24,Female,Masters of Science,6/15/2023,No,Looking at demand and importance,First preference was to make a career in medicine ,Realizing my interests and potential in performing better in other field ,"To get a job, to start content writing",10,"By drawing, watching videos, talking it out","No, it is not appropriate. It is meaningless to assess one's intelligence and capabilities based on marks. Moreover, the pattern of the examination does not make a student study for knowledge, but simply for grades. Also, the exam pattern leaves little room for exploration and mindset growth. ","The only problem I have with university entrance exam is reservation, because of which it is difficult to get into one's desired university.",5,3,1,2,4,5,8,Achieving your goals,Using all the knowledge I have gained into creating something meaningful. ,Introducing active learning and critical thinking skills,Peer pressure 
10-08-2022 23:04,22,Female,MBA Marketing and HR,6/30/2023,Yes,"I'm interested in Management,  hence MBA was my choice",Yes,-,A career in B2B SaaS Setting ,5,Introspection and Talking it out,"Yes , it is appropriate ",It's very essential to filter candidates but should not be the only criteria for selection ,4,1,5,2,3,8,9,Anything which keeps me motivated.,Apply it to make an impact in the world.,Case based learning. Education should be a two way communication rather than one way teaching.,Real time projects help in application of theory concepts which gives better clarity and understanding.
10-08-2022 23:05,23,Female,Msc Data science ,06-10-2023,Yes,"My uncle who is a scientist, suggested me this course ","Yes, data science was my first preference ",-,To get placed in a good company,7,Listening music,"No, the current examination pattern is not good enough as it doesn't develope practical knowledge for students. ",Entrance exams are mandatory as it makes sure whether a deserving candidate has been admitted.,3,2,4,5,1,10,6,"Every individual has their own goal as success. To me, success is not only just money but its respect and name you gained through your work.",My education must not only help me to live life but it should be in such a way that people around me must benefit something out of it.,Change of education system is a must. Examinations are just name sake. Rather practical knowledge must be improved.,Gamified learning encourages students by making them learn in a competitive way.
10-08-2022 23:07,22,Female,MBBS,3/15/2024,Sometimes ,Interest in the medical field,Yes it was my first preference ,Nothing ,Complete my post graduation after this,10,Spend time with friends ,"No, it only tests our memorising abilities ",Very competitive ,5,3,4,1,2,10,7,"Happy, healthy and content",Use my knowledge and skill to improve my own life and others',"Change the pattern of examinations, include projects and other activities done in school at the college level as well",Medicine is a very practical subject. So hands on learning would be the best
10-08-2022 23:08,23,Female,Data Science ,7/31/2023,Mostly yes. The curriculum is well planned however not implemented very well. Lack of apt professors and diverse background of all students are two major drawbacks in terms of quality of learning.,"Brand name of VIT, the curriculum and economical fee structure",It wasn't my first preference. PGDBA was my first preference due to it's rigorous curriculum and exposure,Requirement of work experience in Selection process of PGDBA and low fee at VIT,Work in data analytics role to get exposure and industry based learning.,10,"I watch movies, hang out with friends, or take walks. ",I feel the written question answer pattern is good assessment for comprehensive knowledge.. however it gets lost in between exams. some practical and group/solo activities could be done for understanding of concepts,Conservative. Don't consider the fact that all students understand and express knowledge and understanding in different ways.,4,2,1,5,3,3,10,Accomplishing the goals i set for myself,I'm not sure yet,Implementation of National Education Policy 2020,Doing projects means Concepts Applied in two words. It is a crash course on application of various important concepts and learning over reading the applications off the internet. 
10-08-2022 23:10,21,Male,M.Sc. Data Science ,10-08-2023,Nah,Placements ,Yes ,None ,Work as an Analyst ,10,Sleeping and eating ,Worst system in existence. ,Good Way to judge a candidate ,1,2,3,4,5,5,10,Be happy in life with whatever I'm doing. ,Knowledge ,Rather than teaching students stuff that won't even help them in their future they should teach practical things which are helpful in real world!,More efficient way of learning. 
10-08-2022 23:11,22,Female,MSc Data Science ,06-01-2023,Netural ,Current technology improvement ,Yes,Its my first preference ,Get placed ,10,Listening songs and speaking with frds ,Nope,Just for name sake,2,3,1,4,5,9,8,Try until you get success ,Knowledge and High salary job ,Basic should be strong and I think teacher should be more knowledgeable to teach the basics,Technology development 
