10-08-2022 23:14,22,Female,M.Sc. in Microbiology,5/31/2023,yes,having interest,yes,no,get a decent job,7,wanna stay calm and finish the work taking small breaks in between,no. this semester system don't give us enough time to understand a subject properly. ,it can be good as we can get a chance though previous grades do not matter,1,2,4,5,3,8,9,to get what i want,"great knowledge, financial stability, mental peace",more practical educations and projects and events,i have interest
10-08-2022 23:17,20,Male,B.Sc,5/27/2023,No. I'm noy,It's three years instead of engineering which is 4,It definitely wasn't. Not really sure what my first preference would have been,"Parents, family, circumstances and years of studying as a science student",Just to do what I love and be happy,8,By sleeping,No It's not. Its just focused on scoring marks and emphasis memory than understanding,They are no different than the regular exams. ,1,3,5,2,4,3,4,Waking up everyday and looking forward to live that day and do what we love. ,An experience on how life treats us in different scenarios,"To not focus on marks. Rather one's interest and encouraging to do something new, something one loves",Just to get done with education. 
10-08-2022 23:18,22,Male,B.E/BTech - Information Science ,08-01-2022,Yeah,Similar field of interest ,CSE but similar syllabus ,Rank for the merit seat,Data Engineer/ Data Analyst,3,taking breaks and working ,More practical approach needed than theory/outdated syllabus ,"Change overall approch, make it less stressful ",5,2,1,3,4,8,9,Achieve what you desire,Get the best out of it,Make it modern probably and more interactive based,easier to adapt to corporate 
10-08-2022 23:21,22,Female,Data science,10-08-2023,No,Trending topic,Physics,Booming sector,10yrs want to work as analyst and business,9,Boosting up myself be telling positive words and thoughts,No,"
It could be better if it is possible to have an entrance exam
",3,2,4,5,1,9,6,Hard word without expecting .,want to get lots of knowledge and ideas and want to share to everyone,common system to all . equality in education,to achieve a short time goal 
10-08-2022 23:21,23,Female,Data science,6/30/2023,No,Family,Statistics,Curriculum,Data scientist,8,Diverting myself,No,They should remove the category system,3,2,4,5,1,7,7,Knowledge,Knowledge and money,By improving curriculum,Interest
10-08-2022 23:25,22,Female,Data Science ,06-01-2023,Yes ,Because of high demand and money.,Yes,Data science is a very growing and high paying field. ,To get a job in a reputed company and upskill myself with latest technologies.,6,"By watching movies , listening songs and sleep","No , it's all about mugging things and it only tests the knowledge of whatever student learnt in class.","There are very less seats in comparison to the talented people accross the country. Also , exams are very tough and difficult to crack. I think the seats should be increased and quota system should be removed.",2,3,4,1,5,8,9,"The term success differs for everyone. For some , it's all about scoring high grades . For some , it is getting gold medals in Olympics. For me success is getting a high paying job and living a luxury life. ","With my education, I want to get a good paying job. Apart from it , i want to gain some values that will help me throughout my life.","In schools and college , focus should be more on physical learning. Technical skills should be taught from the primary level school. Students should not be motivated to mug up things . Instead they should understand everything properly and apply in real life.",I think one should attend classes rather than studying at home because majority of people won't study. Students will get distracted and won't get proper environment.
10-08-2022 23:28,22,Female,M.Sc. Data Science ,5/26/2023,Yes,I'm interested in Statistics as well as programming.,Yes,NA,I haven't think about it.,8,Listen to song ,Yes,Good ,5,1,2,3,4,7,9,Being a achieved person. ,Employment ,By using modern learning techniques ,I liked the subject 
10-08-2022 23:29,22,Female,Student B Pharm ,12-01-2022,Yes,Inspired by family and CET results,"Bds, Mbbs, B pharm",This was the best option for me based on my interest and exam results. ,Completing my Masters in Pharmacy,8,I listen to music and watch dramas to distract myself. I also try to be punctual to reduce piling of work.,Not really. Honestly many students don't remember what they have studied after the completion of exams. It's not evaluating the students based on the requirements of practical world.,Stressful and highly competitive and complicated.,5,4,1,2,3,10,8,Success is when you complete one level and start preparing for the next. There is no ultimate level. However being happy and peaceful is also Success.,I want to at least earn a doctorate with PhD and maybe post doctorate too in the future.,Practical classes must be inculcated seriously and update with the current scenario and job requirements. All the information that is necessary for students must be provided and not just focusing on completion of syllabus and writing exams.,Personal preference. I am more comfortable with the teacher first explaining the concept and them studying by myself later to see if i fully understood the concept
10-08-2022 23:34,22,Female,MSc. Data Science ,5/31/2023,Yes,My interest towards the field.,Yes. It is my first preference.,Less exposures in the subject in application side.,To work in my field in a company.,7,Listening to music ,No. I think practical knowledge is also required along with subject knowledge which is lacking in the current scenario.,I don't think a student's capability can be evaluated properly by an entrance exam. ,5,4,2,1,3,8,7,Happiness in life.,Knowledge to do something for the society. ,Student's skill should be evaluated by a complete evaluation system rather than conducting exams and grading them through subject knowledge.,Hands-on experience is very much required.
10-08-2022 23:36,19,Female,12th,03-10-2021,Yes,I like maths,Yes,.,Government exams,9,Sleep,Not that much,It's important,5,1,2,3,4,10,5,Happiness and money,Earn money,More active classrooms,I think group study is the best
10-08-2022 23:41,22,Male,MSc data science ,06-08-2023,Yes,Better career opportunities ,No,My father ,To get job,9,With art,Not at all ,It's good filter quality students but main thing u shouldn't encourage donation ,2,3,5,4,1,10,10,It is not given by someone you should earn it,Nothing just a degree ,Don't push them study hard just them to do what they like,I have chosen different path
10-08-2022 23:43,25,Female,Ma English literature ,10-08-2022,Yes,Passion ,Yes,Nothing ,To become a lecturer ,10,I don't ,No. ,Assessment criteria could include various other unconventional forms of knowledge ,5,2,3,1,4,10,1,Contentment ,Happiness ,Make assessments more inclusive ,Like practical learning 
10-08-2022 23:44,25,Female,Msc Data Science ,6/30/2022,Not bad,The future,yes,-,Work in related field,8,-,"No,Not at all",it would be better to have a single exam for all the universities ,4,3,1,2,5,6,8,This is difficult to define!,"Good work,growth,new learnings and good pay",-,-
10-09-2022 00:09,24,Female,MBA(Finance & Marketing),06-10-2023,Yes,Interested in Management studies ,Yes,NA,Good Job ,8,"Yoga, Meditation ",Yes,"More Theoretical based, if it's more  pratical then it would be better.",1,2,3,4,5,7,7,Success is a journey and one must satisfy his work what he did. ,Education must be applied in pratical life.,More practical ,NA
10-09-2022 00:11,18,Female,B.Tech,05-01-2025,Yes,Interest in coding,Yes..,..,Good Placement ,4,Listening music,I don't think so..,VITEEE has good quality of questioning ,5,3,2,1,4,8,7,Satisfaction ,Money,..,..
10-09-2022 00:12,22,Female,MSc Data Science ,5/15/2023,Course is good but teaching methodology and approach used is not satisfactory.Must include practical application ,Interest in programming logic,"Not a first preference, Medical/Radiation Physics",Interest in logic and programming made me change my preference ,Data scientist/analyst,6,"Going on walk, talking to friend",I don't think it's correctly assessing the students knowledge....instead of theory practical approach should be put to test ,instead of theory practical approach should be put to test ,1,2,3,4,5,5,7,Success means to be independent to me..,Better lifestyle and would want to contribute to society in its economic and social growth. ,Practical and hands on learning approach with real world problems,I wanted to work on the curing cancers using radiation more safer than today the technology is. 
10-09-2022 00:29,22,Male,UG,5/25/2021,Kind of,Situations,"Nope. 
I prefer not to talk about it for now. ","Family, people other than family influencing my family. ",A career I've set up for myself with the help of a friend. ,3,"Training - Body and mind, food, chocolates, fake scenarios, gaping into complete darkness, sports. ","I don't feel so. Because whatever is the pattern of examinations accepted worldwide, it's only monetising the students themselves as assets of the future and not as their own independent identities. At one point, it makes an impression that even if they had worked their lives off to get to that successful point, they lose a part of themselves which they eventually begin to search after acquiring what the world wants them to. Examinations should be based on the students' interests and abilities. ",No comments.,4,2,3,1,5,9,8,"Success is the peace one feels that can be related to the life quenching sip of water after a walk under the desert Sun. At the end of the day, what anybody wants, is peace, and that would be my definition. Success, is peace. ",Knowledge,"Education should be free. Knowledge should be free. Not monetised. Knowledge is what should be shared with free will, and not at the expense of someone's life's hard work. ","Self study is one of the best ways to educate oneself, but education under someone's guidance is more preferable since mistakes of someone would be pointed out only if viewed from another's point of view. "
10-09-2022 00:52,23,Male,MSc Data science ,10-09-2023,Yes,"Knowing that we are moving towards an online style of life, which meant more and more data. And I wanted to learn how to use that data in a responsible and efficient manner","It was yes. Although the curriculum varies very much from what I had hoped and expected, the subject is still the same.",None,"For now, get a job in a relevant field. And expand my career slowly from there",8,Talking to people helps. Playing cricket watching movies make me forget my worries for that length of time,"Absolutely not. A student not having any knowledge about the subject can easily score good marks while a knowledgeable student may lose out on marks because the answers don't match the ""solution key"". Very few teachers appreciate approaching a problem in a novel way, most of them except us to follow a template which they never provide.","It is necessary to evaluate where the student stands before he/she begins the curriculum. This way a healthy competition standard can be maintained amongst peers and students who are weak will be encouraged to do better. Yes not getting into a university of choice can be depressing, but it does help us to filter out students from a lot.",5,4,1,2,3,8,9,To have enough to take care of the ones close to me and then some.,Get a good job and be successful ,"Merit should be given a greater priority always. Aid should be given after a background check has been done on the student and if he/she truly needs it, give him/her the help otherwise don't crush the dreams of someone just based in their surnames.","The best way to learn is when we do research about a particular topic (for me). We get to know a lot more about the topic and even though it takes more time, our knowledge is complete."
10-09-2022 01:19,22,Female,MSc Data Science ,5/30/2023,Yes,Market value,Yes,NA,Working in corporate sector,8,Music keeps me sane,Not at all. The present examination system only checks the memory of a student and not the knowledge ,Universities must take aptitudes and interviews,1,4,5,3,2,6,8,If you are happy with what you are doing you are successful,As much knowledge as I can gain,Making it more project and practical based,Growing field of data
10-09-2022 01:20,21,Female,"BSc Chemistry, Botany and Microbiology",10-09-2022,Yes,I am deeply interested in bio science fields,It was my first preference ,I did not change my preference ,Master's degree and then job,10,I go to therapy and discuss with my loved ones.,I believe that the current method of assessment is overly stressful and does nothing except assess your capacity for rote memorisation. ,I don't see the point in them. Every new year they devise new exams for this and that to the point where students now have to take 5+ exams to get anywhere. What is the point? We're just being trained to work like slaves.,3,1,5,4,2,9,9,"When I can see to it that my needs and wants are met, and I can have a positive impact on society and humans as a whole.",I want to help improve our understanding of how living things work (biologically),More engaging and practical learning instead of boring theory.,I believe discussion and debate promots understanding.
10-09-2022 01:39,22,Male,Bsc.Information Technology,7/30/2021,"Initially im not happy with it but after some time i get used to it but still if you ask me yes or no, my answer would be No ","There are multiple factors responsible for why i had choosen this course, one of the reason is lack of self awarness, lack of confidence in myself, no proper guidance at right time. If there if confidence and self awarness in myself then there is no need for guidance but at that time anything is ok for me was my mindset again considering  multiple factors  such as economic condition , family condition my sister is there after me .. etc.","I had  preference but not Information Technology as my first preference in fact at the time of admission information technology was only available for me other courses get filled up as i made late decision to take chemistry considering family conditions, im not able get what i need but i got what they had . The main preference for me without considering any economic conditions,  was Bsc.Agriculture this was my interest too from my childhood.",I've already mentioned on these factors in the above fields. So please check it out.,Currently im a VIP its not Very Important Person in tamil we used to say vellai illa pattathari which means graduate without any job. And my short trrm career goal is to get a job 😂 in Information Technology  as a frontend developer... But i dont like it any way i need a job thats why ...,8,By spending time with my passion by cycling and going to badminton and also by talking to my friends,"I have a question for u to answer this question, where will u apply this knowledge that the examination needs, after the assessment gets over.Does every body gets opportunity to apply it practically . The answer according to me is no , the examination pattern is for  assessing theoritical knowledge not the practical one ... ","I've attended one for MCA which was conducted by TANCET for my course there were approx 6000 candidates i got 91% among them without any preperation  but it depends on multiple factors  question paper, main thing is our mind set on the examination day , but speaking as a whole  especially entrance examination for university it is for name sake according to me for that course which ive attended because even if dont get passed i can get a seat in management quota and even if i get through examination only a mere margin of that fee is getting reduced so whats the point in writing that examination.",4,1,2,3,5,7,5,If anything which i've learned is usefull for me and others in the society and if i could do something notable to mother nature it would be a success for me,The answer for this question was  also included above in last answer.,"To make education enjoyable it is practically no possible according to me because i believe everyone has their own taste of method for enjoying their learning and also it always changes with generation to generation what ours parents liked may not be liked by us as we are in fast changing digital era our predictions might be wrong even before releasing our survey thats how fast we are and how slow we are in our decision making  in educational policy anything which matches both the paces is good. And i think the information i useful for the survey , if u need any clarifications feel free to contact me through  my mail... gokulm60it@gmail.com
Thank you",Because i personally experienced it because during my 9th and 10th  i scored good marks  using this method before that i  never tried it and after 10th i dont get that opportunity.
10-09-2022 04:02,22,Male,M.Sc. Data science ,06-01-2023,Yes,Interest in data,Yes,NIL,Work for a good organization which will help me to learn and grow.,8,Listening songs,"According to me No, it should be more practical based and mainly should be industry related.",They are necessary in order to filter out the rest.,1,2,4,3,5,9,7,"Success to me is not anything huge but just want to be independent, responsible, good person, and a good data scientist.",I want to work for a good organization in order to express my knowledge and also learn new techniques which will help me grow.,"It's fun till school sangoty but nahii thik aa
You wear anything you areeen thesssttt",According to me it is not effective and not every student will study.
10-09-2022 05:39,22,Female,Data science ,06-09-2023,Yes,Personal interest ,"Yes it is
",No change,Get a core job in a good company ,8,Self realisation and meditation ,Yes it is fair enough ,The exam is conducted all india basis so everyone gets equal opportunities to excel in the exam.,5,1,2,3,4,7,9,When a person is proud of what they have achieved ,I want to successfully apply my knowledge in real life cases ,Interactive sessions,It enables creative and cognitive thinking ability 
10-09-2022 08:06,22,Male,"CA Inter (Chartered Accountancy Course), B Com (A&F)",4/30/2020,Not completely,Interest towards the subject & profession,Yes,NA,To complete the course and get a job,10,Not good at managing stress 🥲 (any tips?),"No, the current exam pattern focuses more on the memory capacity of the student, rather than his practical or professional capacity.","In most of the cases, the school educational curriculum itself should have prepared the student to clear university entrance examinations, but since it's not the case, unless the coaching is same for everyone, it benefits only the higher class of the society.",5,3,1,2,4,10,7,Ability to live a happy life with whatever you have.,A happy life to live.,"Identify the interests and talent of the students at a much earlier age, streamlining them towards the development of their talents by more of a vocational kind of syllabus, examining them with practical knowledge.",Learning through doing projects and engaging them with real life problems - helps the students in understanding the problems and challanges they are expected to face in their professional career and will ultimately grow them as a professional from the campus itself.
10-09-2022 08:07,22,Male,B.E in Mechanical,07-07-2022,Satisfactory ,Interest and Passion,"Yes, it was first preference.",Did not change my preference ,Earning as much as possible.,8,Talk to people and play cricket.,Not appropriate.,Reservation system should be stopped.,5,1,3,4,2,10,4,Happiness and Contentment.,Solve problems at my workplace,"Constant adaptation of syllabus to present scenario, abandonment of reservation system, good education infrastructure and environment.",Passion towards Automobile 
10-09-2022 09:06,21,Female,M. Sc mathematics,7/31/2023,Yes,Interested in this course,Yes,No,Get a job,3,Watching movies,Not much,Not required,2,3,4,5,1,8,7,Satisfy ur self,Knowledge,Open classroom,Interest
10-09-2022 09:11,23,Female,MSC biomedical genetics ,6/15/2023,yes,I was interested in doing higher studies,it was my first preference ,nil,get an internship ,6,watch videos or movies,no,"foe masters entrance,  the syllabus should include the portion taught in bachlors rather than 11 and 12th standard ",2,3,1,4,5,8,9,when you can provide for ur parents ,a good lifestyle ,"stop focusing so much on the ranks , rather focus on the students suffering behind to get those Mark's ",I was interested in genetics 
10-09-2022 09:17,24,Female,MBBS,2/15/2021,Yes,My dream,Yes,None,Study further,6,Hobbies. Music and book reading. ,Not really. Current examination system is focused mainly on the ability of the student to remember rather than apply. But in medical field I have heard recently the curriculum has changed tona more practical one which is how every course and discipline exams should be. ,They also should follow the more practical skills and knowledge than just theory and mugging.,2,1,5,3,4,8,9,"Hard working and sincere efforts to learn and being curious is the baseline. When you are not curious, you are not putting enough effort to understand the concepts and hence the result. ",My dreams of being a decent successful and self independent working woman. ,"Like I said, the methodology of teaching, the protocol of learning and the curriculum has to be revised and made differently for a change to be visible. Active learning over passive. ",Active learning has always proved effective and hence implementation of the same in the curriculum would be a promising teaching method for the future students. 
10-09-2022 09:23,22,Female,BSc (Hons) Horticulture ,07-02-2022,No,Had no option ,Doctor ,Financial status,Banking exams,5,Calm down my self n by being social ,"No, it's only assessing our memory not a knowledge at all",It's just a memory based formality test,1,2,3,5,4,7,8,When I achieve my goal n lead a happy n peaceful life,Not related ,"It's should be more practical oriented than theory, newer technology should be included rather studying 20 years old syllabus which is not useful in this changing era",..
10-09-2022 09:40,23,Female,M.Sc. Decision and computing sciences,5/30/2022,Yes,The curriculum and the course structure,My first preference was medicine,Because of some personal reasons,To excel in the company I'm working in and reach greater positions,5,"Doing the things I love to do like travelling, listening to music, dance",No,Entrance examinations are very good option because the students who truly deserve the seats are getting into the universities they are interested in,4,2,1,3,5,8,4,Learning new things everyday even if it is small,The basic things I need to start my career ,Make it more practical than theories,Because it was my interest
10-09-2022 09:42,22,Male,"BSc in physics, chemistry, mathematics",07-03-2021,Yes ,My interest in the subject,No my first preference was Bsc in Mathematics and computer science ,Unavailability of the subjects of my preference in the college,To be an expert in the field of AI And ML,6,Listening to music and playing games,Yes it is but sometimes it becomes more about scoring in an examination rather than accessing students knowledge ,The method of conducting MCQ based entrance examinations isn't exactly the right way to test the knowledge. I would prefer interview based selections. ,4,1,3,2,5,2,3,Doing something you love in life and being happy,Knowledge which can help me give back something to the world,"By not focusing on marks based learning and by reducing the stressful environment from being created, education in India can be enjoyable ",Active learning is when a group of students engage among themselves it helps in increasing your thinking capability and strengthens your knowledge 
10-09-2022 10:02,22,Male,Electronics and Communication Engineering,7/31/2023,yes,I have interest on doing it ,not sure about that,nile,ECE designer/Circuit building or any other career ,5,By listening to music/seeing a comedy video   ,No I guess ,niel,1,2,3,4,5,8,5,By motivating one self,By getting placed into good company ,"By making some visual projects, by making some models, doing some activities (which should be useful).",To improve our nation and our country 
10-09-2022 10:26,18,Female,BSc hons agriculture ,03-05-2026,Yes,Interest in that area ,Yes ,Nothing influenced me ,Learn,5,"Read,  write , watch movies ",No,They are needed ,3,2,4,1,5,3,9,Happiness,Give back to the society,"More hands on , practical approach ",Interest 
10-09-2022 10:45,24,Male,PG Diploma ,3/21/2021,Yes,Self interest ,"Yes, it was my preference.",None ,Gain knowledge in the current field.,4,By not taking the grades seriously.,Yes it does test our knowledge.,Entrance examinations are something that I don't like. ,1,5,4,3,2,9,4,Being satisfied/happy with myself.,Gain knowledge that can be used in my life.,Less attention to grades and more attention to practicals. Practical in the sense with more real life application.,"What is taught to us should be applicable in some way or the other, if not it's a wast of time."
